{
  "source": {
    "name": "lucide-static",
    "version": "1.62.0",
    "license": "ISC",
    "url": "https://lucide.dev"
  },
  "grid": 24,
  "stroke": {
    "width": 1.75,
    "linecap": "round",
    "linejoin": "round"
  },
  "usage": [
    "Use only these icons. Never mix in another icon family or hand-drawn paths.",
    "One stroke weight everywhere: 1.75 on the 24px grid. Do not restyle per icon.",
    "Render at 14, 16, 18 or 20px. 16 is the default; use 20 for prominent controls.",
    "Pair the icon with a text label when the action is ambiguous or destructive.",
    "Icon-only controls need aria-label (and a title tooltip). Decorative icons need aria-hidden=\"true\".",
    "Icons inherit currentColor. Do not tint icons for decoration; colour only for meaning (state, trading movement, destructive).",
    "Filled variants are for state only: play, pause, stop, active like or favourite. Never fill an icon for emphasis.",
    "Do not use an icon beside every label. If removing it loses no meaning, remove it.",
    "Need a new icon? Add it to the catalog from Lucide, with a stable Summa name; never rename an existing name."
  ],
  "categories": [
    "actions",
    "navigation",
    "status-feedback",
    "editor",
    "files-folders",
    "media",
    "communication",
    "commerce",
    "finance-markets",
    "people-objects",
    "data-charts",
    "layout",
    "time-travel",
    "system"
  ],
  "icons": [
    {
      "name": "plus",
      "lucide": "plus",
      "category": "actions",
      "tags": [
        "add",
        "create",
        "new"
      ],
      "use": "Add or create an item in the current context.",
      "avoid": "Do not place beside a dropdown that can hold the create action itself.",
      "file": "icons/svg/plus.svg"
    },
    {
      "name": "minus",
      "lucide": "minus",
      "category": "actions",
      "tags": [
        "remove",
        "subtract",
        "collapse"
      ],
      "use": "Decrease a quantity or collapse an item.",
      "file": "icons/svg/minus.svg"
    },
    {
      "name": "x",
      "lucide": "x",
      "category": "actions",
      "tags": [
        "close",
        "dismiss",
        "clear",
        "cancel"
      ],
      "use": "Close a surface, dismiss a message or clear a field.",
      "file": "icons/svg/x.svg"
    },
    {
      "name": "check",
      "lucide": "check",
      "category": "actions",
      "tags": [
        "confirm",
        "done",
        "selected",
        "tick"
      ],
      "use": "Show a selected option or a completed step.",
      "file": "icons/svg/check.svg"
    },
    {
      "name": "search",
      "lucide": "search",
      "category": "actions",
      "tags": [
        "find",
        "query",
        "lookup"
      ],
      "use": "Open or label a search field.",
      "file": "icons/svg/search.svg"
    },
    {
      "name": "copy",
      "lucide": "copy",
      "category": "actions",
      "tags": [
        "duplicate",
        "clipboard"
      ],
      "use": "Copy content or duplicate an item.",
      "file": "icons/svg/copy.svg"
    },
    {
      "name": "clipboard",
      "lucide": "clipboard",
      "category": "actions",
      "tags": [
        "paste",
        "board"
      ],
      "use": "Paste from, or hold content on, the clipboard.",
      "file": "icons/svg/clipboard.svg"
    },
    {
      "name": "pencil",
      "lucide": "pencil",
      "category": "actions",
      "tags": [
        "edit",
        "rename",
        "write"
      ],
      "use": "Edit or rename an existing item.",
      "file": "icons/svg/pencil.svg"
    },
    {
      "name": "trash",
      "lucide": "trash-2",
      "category": "actions",
      "tags": [
        "delete",
        "remove",
        "destroy"
      ],
      "use": "Delete an item. Pair with a verb label in destructive buttons.",
      "avoid": "Do not use alone for irreversible actions without confirmation.",
      "file": "icons/svg/trash.svg"
    },
    {
      "name": "refresh",
      "lucide": "refresh-cw",
      "category": "actions",
      "tags": [
        "reload",
        "sync",
        "retry"
      ],
      "use": "Reload data or retry a failed action.",
      "file": "icons/svg/refresh.svg"
    },
    {
      "name": "undo",
      "lucide": "undo-2",
      "category": "actions",
      "tags": [
        "back",
        "revert"
      ],
      "use": "Undo the last change.",
      "file": "icons/svg/undo.svg"
    },
    {
      "name": "redo",
      "lucide": "redo-2",
      "category": "actions",
      "tags": [
        "forward",
        "repeat"
      ],
      "use": "Redo an undone change.",
      "file": "icons/svg/redo.svg"
    },
    {
      "name": "download",
      "lucide": "download",
      "category": "actions",
      "tags": [
        "save",
        "export",
        "get"
      ],
      "use": "Download or export to the device.",
      "file": "icons/svg/download.svg"
    },
    {
      "name": "upload",
      "lucide": "upload",
      "category": "actions",
      "tags": [
        "import",
        "send",
        "file"
      ],
      "use": "Upload or import from the device.",
      "file": "icons/svg/upload.svg"
    },
    {
      "name": "share",
      "lucide": "share",
      "category": "actions",
      "tags": [
        "send",
        "export",
        "link"
      ],
      "use": "Share an item outside the current view.",
      "file": "icons/svg/share.svg"
    },
    {
      "name": "external",
      "lucide": "external-link",
      "category": "actions",
      "tags": [
        "open",
        "new-tab",
        "link",
        "out"
      ],
      "use": "Open something in a new tab or another app.",
      "file": "icons/svg/external.svg"
    },
    {
      "name": "more-h",
      "lucide": "ellipsis",
      "category": "actions",
      "tags": [
        "menu",
        "overflow",
        "dots"
      ],
      "use": "Overflow menu for secondary actions in a row or toolbar.",
      "file": "icons/svg/more-h.svg"
    },
    {
      "name": "more-v",
      "lucide": "ellipsis-vertical",
      "category": "actions",
      "tags": [
        "menu",
        "overflow",
        "dots"
      ],
      "use": "Overflow menu for secondary actions in a column or card.",
      "file": "icons/svg/more-v.svg"
    },
    {
      "name": "filter",
      "lucide": "funnel",
      "category": "actions",
      "tags": [
        "narrow",
        "refine"
      ],
      "use": "Open filter controls for a list or table.",
      "file": "icons/svg/filter.svg"
    },
    {
      "name": "sort",
      "lucide": "arrow-up-down",
      "category": "actions",
      "tags": [
        "order",
        "rank"
      ],
      "use": "Change the sort order of a list.",
      "file": "icons/svg/sort.svg"
    },
    {
      "name": "sliders",
      "lucide": "sliders-vertical",
      "category": "actions",
      "tags": [
        "adjust",
        "settings",
        "tune"
      ],
      "use": "Adjust parameters or open a compact set of options.",
      "file": "icons/svg/sliders.svg"
    },
    {
      "name": "move",
      "lucide": "move",
      "category": "actions",
      "tags": [
        "drag",
        "reposition"
      ],
      "use": "Move or reposition an item.",
      "file": "icons/svg/move.svg"
    },
    {
      "name": "scissors",
      "lucide": "scissors",
      "category": "actions",
      "tags": [
        "cut",
        "trim"
      ],
      "use": "Cut or trim content.",
      "file": "icons/svg/scissors.svg"
    },
    {
      "name": "archive",
      "lucide": "archive",
      "category": "actions",
      "tags": [
        "store",
        "put-away"
      ],
      "use": "Archive an item without deleting it.",
      "file": "icons/svg/archive.svg"
    },
    {
      "name": "save",
      "lucide": "save",
      "category": "actions",
      "tags": [
        "store",
        "persist",
        "disk"
      ],
      "use": "Save changes explicitly.",
      "avoid": "Do not use when saving is automatic.",
      "file": "icons/svg/save.svg"
    },
    {
      "name": "send",
      "lucide": "send",
      "category": "actions",
      "tags": [
        "submit",
        "post",
        "message"
      ],
      "use": "Send a message or submit a post.",
      "file": "icons/svg/send.svg"
    },
    {
      "name": "zap",
      "lucide": "zap",
      "category": "actions",
      "tags": [
        "fast",
        "power",
        "flash"
      ],
      "use": "Quick action or power state.",
      "avoid": "Avoid as decoration.",
      "file": "icons/svg/zap.svg"
    },
    {
      "name": "sparkle",
      "lucide": "sparkles",
      "category": "actions",
      "tags": [
        "ai",
        "magic",
        "generate"
      ],
      "use": "Mark generated or AI-assisted content and actions.",
      "avoid": "Do not scatter it as decoration.",
      "file": "icons/svg/sparkle.svg"
    },
    {
      "name": "maximize",
      "lucide": "maximize",
      "category": "actions",
      "tags": [
        "fullscreen",
        "expand"
      ],
      "use": "Enter full screen or expand to fill the space.",
      "file": "icons/svg/maximize.svg"
    },
    {
      "name": "minimize",
      "lucide": "minimize-2",
      "category": "actions",
      "tags": [
        "shrink",
        "exit",
        "fullscreen"
      ],
      "use": "Leave full screen or shrink a view.",
      "file": "icons/svg/minimize.svg"
    },
    {
      "name": "expand",
      "lucide": "chevrons-up-down",
      "category": "actions",
      "tags": [
        "toggle",
        "collapse",
        "open"
      ],
      "use": "Show that a control opens a list of choices.",
      "file": "icons/svg/expand.svg"
    },
    {
      "name": "chevron-down",
      "lucide": "chevron-down",
      "category": "navigation",
      "tags": [
        "disclose",
        "dropdown",
        "open"
      ],
      "use": "Expand a dropdown, disclosure or section.",